{
  "candidate": {
    "condition": "C3_GENERIC_COMPOSITION",
    "slot": 0,
    "world_id": "h-52dfdb7df153f50fdcb0",
    "world_seed": 40000
  },
  "commitment": {
    "archived_theory_hash": "def8cd0bed4456a38c6e3135a51209dad17053edaaa132d74cb738b1f17efabe",
    "ordering": {
      "basis": "posthoc_code_inspection",
      "source": "src/abductive_jump/compositional_experiment.py:589; control flow, not an independently timestamped reveal event",
      "value": "fit -> calls -> overwrite -> parse -> freeze -> hidden losses"
    },
    "original_digest": {
      "basis": "unavailable",
      "source": "Not persisted in the archived candidate result",
      "value": null
    },
    "original_timestamp": {
      "basis": "unavailable",
      "source": "Not persisted in the archived candidate result or call ledger",
      "value": null
    },
    "reconstructed": {
      "basis": "posthoc_reconstruction",
      "source": "src/abductive_jump/executable.py:freeze_theory",
      "value": {
        "digest": "8edcb5d4ddc4981ee7bb7f27abc23bab83b38a744efb8dac37bdbed808c93ec4",
        "intervention_predictions": [
          [
            "test-0",
            2268.0
          ]
        ],
        "split_hash": "53ab4815493f5851c2977e1287043efdbb79cb801ee8f0dc256b00d1c57948ac",
        "theory_hash": "def8cd0bed4456a38c6e3135a51209dad17053edaaa132d74cb738b1f17efabe",
        "world_id": "h-52dfdb7df153f50fdcb0"
      }
    }
  },
  "evaluation": {
    "basis": "runtime_recorded",
    "source": "artifacts/compositional/confirmatory-heldout/candidate_results.parquet",
    "value": {
      "j0": true,
      "j1": true,
      "j2": true,
      "j3": true,
      "j4": true,
      "j5": true,
      "validated_jump": true
    }
  },
  "fields": {
    "action": {
      "basis": "runtime_recorded",
      "producer": "deterministic_component",
      "read_by_gate": true,
      "source": "artifacts/compositional/confirmatory-heldout/candidate_results.parquet:exact_designer_intervention_id",
      "value": [
        "test-0"
      ]
    },
    "explanation": {
      "basis": "runtime_recorded",
      "producer": "model",
      "read_by_gate": false,
      "source": "artifacts/compositional/confirmatory-heldout/llm_calls.jsonl:line 20",
      "value": "The expression models the outcome as the product of inputs scaled by 9, matching the cubic relationship."
    },
    "expression": {
      "basis": "posthoc_reconstruction",
      "producer": "deterministic_component",
      "read_by_gate": true,
      "source": "artifacts/compositional_candidates.parquet:expression_json; parse_theory variable translation",
      "value": {
        "left": {
          "op": "const",
          "value": 9.0
        },
        "op": "mul",
        "right": {
          "left": {
            "left": {
              "name": "w",
              "op": "var"
            },
            "op": "mul",
            "right": {
              "name": "x",
              "op": "var"
            }
          },
          "op": "mul",
          "right": {
            "name": "z",
            "op": "var"
          }
        }
      }
    },
    "parameters": {
      "basis": "posthoc_reconstruction",
      "producer": "deterministic_component",
      "read_by_gate": true,
      "source": "compositional_realization:fit_composed_representation",
      "value": [
        9.0
      ]
    },
    "prediction": {
      "basis": "posthoc_reconstruction",
      "producer": "deterministic_component",
      "read_by_gate": true,
      "source": "src/abductive_jump/executable.py:freeze_theory",
      "value": [
        [
          "test-0",
          2268.0
        ]
      ]
    },
    "ranking": {
      "basis": "posthoc_code_inspection",
      "producer": "deterministic_component",
      "read_by_gate": false,
      "source": "src/abductive_jump/compositional_experiment.py:_condition_candidates",
      "value": {
        "ancestry": [
          "REIFY_EDGE_AS_NODE",
          "CHANGE_ARITY",
          "BIND_ARGUMENT",
          "BIND_ARGUMENT"
        ],
        "policy": "diversity-aware deterministic selection",
        "slot": 0
      }
    },
    "representation": {
      "basis": "posthoc_reconstruction",
      "producer": "deterministic_component",
      "read_by_gate": true,
      "source": "artifacts/compositional_candidates.parquet:representation_json",
      "value": {
        "edges": [
          {
            "relation": "input_to",
            "source": "dax",
            "target": "mep"
          },
          {
            "relation": "argument_0",
            "source": "mep",
            "target": "reified_candidate_3"
          },
          {
            "relation": "result_of",
            "source": "reified_candidate_3",
            "target": "taz"
          },
          {
            "relation": "argument_1",
            "source": "suv",
            "target": "reified_candidate_3"
          },
          {
            "relation": "input_to",
            "source": "suv",
            "target": "mep"
          },
          {
            "relation": "argument_2",
            "source": "wug",
            "target": "reified_candidate_3"
          },
          {
            "relation": "input_to",
            "source": "wug",
            "target": "mep"
          }
        ],
        "nodes": [
          {
            "attributes": {
              "family": "cubic",
              "role": "incumbent_rule"
            },
            "id": "mep",
            "kind": "Equation"
          },
          {
            "attributes": {
              "role": "third_input"
            },
            "id": "dax",
            "kind": "Observable"
          },
          {
            "attributes": {
              "role": "input"
            },
            "id": "suv",
            "kind": "Observable"
          },
          {
            "attributes": {
              "role": "outcome"
            },
            "id": "taz",
            "kind": "Observable"
          },
          {
            "attributes": {
              "role": "second_input"
            },
            "id": "wug",
            "kind": "Observable"
          },
          {
            "attributes": {
              "arity": 3
            },
            "id": "reified_candidate_3",
            "kind": "Relation"
          }
        ],
        "schema_version": "1"
      }
    }
  },
  "raw_calls": [
    {
      "basis": "runtime_recorded",
      "decoding_seed": 614800001,
      "ledger_path": "artifacts/compositional/confirmatory-heldout/llm_calls.jsonl",
      "line": 6,
      "output": "```json\n{\n  \"representation\": \"USE_SUPPLIED_REPRESENTATION\",\n  \"derivation\": \"For each observation, the rule mep = dax * suv * wug matches the outcomes exactly.\",\n  \"expression\": {\n    \"op\": \"mul\",\n    \"left\": {\n      \"op\": \"mul\",\n      \"left\": {\n        \"name\": \"dax\",\n        \"op\": \"var\"\n      },\n      \"right\": {\n        \"name\": \"suv\",\n        \"op\": \"var\"\n      }\n    },\n    \"right\": {\n      \"name\": \"wug\",\n      \"op\": \"var\"\n    }\n  },\n  \"explanation\": \"The expression represents the product of the inputs dax, suv, and wug, which matches the observed outcomes.\",\n  \"selected_intervention_ids\": [\"test-0\"]\n}\n```",
      "parsed": {
        "derivation": "For each observation, the rule mep = dax * suv * wug matches the outcomes exactly.",
        "explanation": "The expression represents the product of the inputs dax, suv, and wug, which matches the observed outcomes.",
        "expression": {
          "left": {
            "left": {
              "name": "dax",
              "op": "var"
            },
            "op": "mul",
            "right": {
              "name": "suv",
              "op": "var"
            }
          },
          "op": "mul",
          "right": {
            "name": "wug",
            "op": "var"
          }
        },
        "representation": "USE_SUPPLIED_REPRESENTATION",
        "selected_intervention_ids": [
          "test-0"
        ]
      },
      "prompt_hash": "b936434fc6f403178428a17c7e36fc67ede6ea53c51df844bdff0dad5b8c8b65"
    },
    {
      "basis": "runtime_recorded",
      "decoding_seed": 614800002,
      "ledger_path": "artifacts/compositional/confirmatory-heldout/llm_calls.jsonl",
      "line": 20,
      "output": "```json\n{\n  \"representation\": \"USE_SUPPLIED_REPRESENTATION\",\n  \"derivation\": \"Expression 9 * dax * suv * wug fits all observations: 9 * 6 * 6 * 6 = 1944, 9 * 1 * 1 * 1 = 9, 9 * 2 * 2 * 2 = 72.\",\n  \"expression\": \"USE_SUPPLIED_FITTED_EXPRESSION\",\n  \"explanation\": \"The expression models the outcome as the product of inputs scaled by 9, matching the cubic relationship.\",\n  \"selected_intervention_ids\": [\"test-0\"]\n}\n```",
      "parsed": {
        "derivation": "Expression 9 * dax * suv * wug fits all observations: 9 * 6 * 6 * 6 = 1944, 9 * 1 * 1 * 1 = 9, 9 * 2 * 2 * 2 = 72.",
        "explanation": "The expression models the outcome as the product of inputs scaled by 9, matching the cubic relationship.",
        "expression": "USE_SUPPLIED_FITTED_EXPRESSION",
        "representation": "USE_SUPPLIED_REPRESENTATION",
        "selected_intervention_ids": [
          "test-0"
        ]
      },
      "prompt_hash": "313401b4cd699535d5b38f71c915dde0601c2d97ef0d335db8dfcfbb8842766a"
    }
  ],
  "record_kind": "mixed_archival_and_reconstructed_evidence",
  "replay": {
    "basis": "posthoc_reconstruction",
    "source": "scripts/build_aij_evidence_record.py:build_record",
    "value": {
      "adaptive_research": false,
      "commitment": {
        "digest": "1c21e381c93bae03a5f724dad7247a96ef13fcd4bc4d10c94e94ff970407a632",
        "intervention_predictions": [
          [
            "test-0",
            2268.0
          ]
        ],
        "split_hash": "53ab4815493f5851c2977e1287043efdbb79cb801ee8f0dc256b00d1c57948ac",